[
  {
    "id": 1,
    "slug": "figma",
    "Tool Name": "Figma",
    "Data Type": [
      {
        "slug": "tool",
        "label": "Tool"
      }
    ],
    "Tool URL": "https://figma.com",
    "Tool Logo": [
      {
        "name": "figma.png",
        "url": "https://baserow-backend-production20240528124524339000000001.s3.amazonaws.com/user_files/RkZQ8YnIuh2oyvQUZcZDY9XODXPuXrcN_ddfd248ffa9293feb739393a03a821508fada1c701b9b35b1923ff3ee43ed142.png"
      }
    ],
    "Category": "User Experience",
    "Tool Description": "Figma is a design tool where teams build the actual screens of a product, from rough wireframes to polished, clickable prototypes. Because it runs in the browser and lets people work together in real time, it is often where design and development meet, with designers laying out interfaces and handing off clear specs for engineers to build.",
    "Tool Features": "1. Build low fidelity interfaces\n1. Build high fidelity interfaces\n1. Create animations\n1. Create design components\n1. Define the UI styles\n1. Define the specifications for development",
    "Tool Direct Competitors": "1. [Sketch](https://www.sketch.com/)\n1. [InVision](https://www.invisionapp.com/)\n1. [Balsamiq](https://balsamiq.com/)\n1. [Axure](https://www.axure.com/)\n1. [Framer](https://www.framer.com/)",
    "Common Tasks Using the Tool": [
      {
        "slug": "wireframing",
        "label": "Wireframing"
      },
      {
        "slug": "design-component-creation",
        "label": "Design Component Creation"
      },
      {
        "slug": "brand-identity-formation",
        "label": "Brand Identity Formation"
      },
      {
        "slug": "icon-and-logo-creation",
        "label": "Icon and Logo Creation"
      },
      {
        "slug": "storyboarding",
        "label": "Storyboarding"
      },
      {
        "slug": "ui-kit-creation",
        "label": "UI Kit Creation"
      },
      {
        "slug": "developing-information-architecture",
        "label": "Developing Information Architecture"
      },
      {
        "slug": "prototype-creation",
        "label": "Prototype Creation"
      },
      {
        "slug": "clickable-prototype-creation",
        "label": "Clickable Prototype Creation"
      },
      {
        "slug": "customer-experience-mapping",
        "label": "Customer Experience Mapping"
      },
      {
        "slug": "rapid-ideation",
        "label": "Rapid Ideation"
      },
      {
        "slug": "copywriting",
        "label": "Copywriting"
      },
      {
        "slug": "creating-illustrations",
        "label": "Creating Illustrations"
      },
      {
        "slug": "primary-research",
        "label": "Primary Research"
      },
      {
        "slug": "choosing-research-methods",
        "label": "Choosing Research Methods"
      },
      {
        "slug": "release-vision-definition",
        "label": "Release Vision Definition"
      },
      {
        "slug": "optimizing-seo",
        "label": "Optimizing SEO"
      },
      {
        "slug": "creating-annotations",
        "label": "Creating Annotations"
      }
    ],
    "Roles": [
      {
        "slug": "ux-user-experience-design",
        "label": "UX (User Experience) Design"
      },
      {
        "slug": "ux-user-experience-research",
        "label": "UX (User Experience) Research"
      },
      {
        "slug": "ux-user-experience-writing",
        "label": "UX (User Experience) Writing"
      },
      {
        "slug": "graphic-design",
        "label": "Graphic Design"
      }
    ],
    "Where Can I Learn More?": "https://help.figma.com/"
  },
  {
    "id": 2,
    "slug": "notion",
    "Tool Name": "Notion",
    "Data Type": [
      {
        "slug": "tool",
        "label": "Tool"
      }
    ],
    "Tool URL": "https://notion.so",
    "Tool Logo": [
      {
        "name": "notion.jpg",
        "url": "https://baserow-backend-production20240528124524339000000001.s3.amazonaws.com/user_files/JtoWY68TiPhL6wOR6G73dOZunT3H5N7T_c35888332ff517f574f8577be7f1e8a9396eda1b7d2b9e4310e5f872e557aeec.jpg"
      }
    ],
    "Category": "Operations, User Experience, Product Management",
    "Tool Description": "Notion is an all-in-one workspace for notes, documents, wikis, and simple databases. Teams use it to keep everything in one place, meeting notes, project plans, and shared knowledge that would otherwise get scattered, so anyone can find what they need without digging through a dozen tools.",
    "Tool Features": "1. Create docs and wikis\n2. Build databases and boards\n3. Organize a team knowledge base\n4. Track tasks and backlogs\n5. Collaborate in real time",
    "Tool Direct Competitors": "1. [Confluence](https://www.atlassian.com/software/confluence)\n1. [Gitbook](http://gitbook.com)",
    "Common Tasks Using the Tool": [
      {
        "slug": "release-scope-definition",
        "label": "Release Scope Definition"
      },
      {
        "slug": "requirements-gathering",
        "label": "Requirements Gathering"
      },
      {
        "slug": "requirements-refinement",
        "label": "Requirements Refinement"
      },
      {
        "slug": "brand-identity-formation",
        "label": "Brand Identity Formation"
      },
      {
        "slug": "writing-requirements",
        "label": "Writing Requirements"
      },
      {
        "slug": "feature-vision-definition",
        "label": "Feature Vision Definition"
      },
      {
        "slug": "feature-scope-definition",
        "label": "Feature Scope Definition"
      },
      {
        "slug": "generating-problem-statements",
        "label": "Generating Problem Statements"
      },
      {
        "slug": "strategy-definition",
        "label": "Strategy Definition"
      },
      {
        "slug": "sprint-planning",
        "label": "Sprint Planning"
      },
      {
        "slug": "level-of-effort-estimation",
        "label": "Level of Effort Estimation"
      },
      {
        "slug": "velocity-calculation",
        "label": "Velocity Calculation"
      },
      {
        "slug": "presenting-research-results",
        "label": "Presenting Research Results"
      },
      {
        "slug": "kickoff-intake",
        "label": "Kickoff / Intake"
      },
      {
        "slug": "defining-team-working-agreements",
        "label": "Defining Team Working Agreements"
      },
      {
        "slug": "team-role-and-responsibility-definition",
        "label": "Team Role and Responsibility Definition"
      },
      {
        "slug": "product-positioning",
        "label": "Product Positioning"
      },
      {
        "slug": "contextual-inquiries",
        "label": "Contextual Inquiries"
      },
      {
        "slug": "observing-ethnography",
        "label": "Observing (Ethnography)"
      },
      {
        "slug": "usability-testing",
        "label": "Usability Testing"
      },
      {
        "slug": "prototype-concept-testing",
        "label": "Prototype Concept Testing "
      },
      {
        "slug": "a-b-prototype-test-creation",
        "label": "A/B Prototype Test Creation"
      },
      {
        "slug": "developing-information-architecture",
        "label": "Developing Information Architecture"
      },
      {
        "slug": "tracking-milestone-progress",
        "label": "Tracking Milestone Progress"
      },
      {
        "slug": "tracking-epic-progress",
        "label": "Tracking Epic Progress"
      },
      {
        "slug": "product-roadmap-maintenance",
        "label": "Product Roadmap Maintenance"
      },
      {
        "slug": "market-research",
        "label": "Market Research"
      },
      {
        "slug": "scheduling-meetings",
        "label": "Scheduling Meetings"
      },
      {
        "slug": "qa-testing",
        "label": "QA Testing"
      },
      {
        "slug": "autotest-creation",
        "label": "Autotest Creation"
      },
      {
        "slug": "tracking-sprint-progress",
        "label": "Tracking Sprint Progress"
      },
      {
        "slug": "user-acceptance-testing",
        "label": "User Acceptance Testing"
      },
      {
        "slug": "facilitating-agile-workshops",
        "label": "Facilitating Agile Workshops"
      },
      {
        "slug": "coaching-team-mates",
        "label": "Coaching Team Mates"
      },
      {
        "slug": "threat-modeling",
        "label": "Threat Modeling"
      },
      {
        "slug": "penetration-testing",
        "label": "Penetration Testing"
      },
      {
        "slug": "firewall-configuration",
        "label": "Firewall Configuration"
      },
      {
        "slug": "security-protocol-definition",
        "label": "Security Protocol Definition"
      },
      {
        "slug": "information-security-audit",
        "label": "Information Security Audit"
      },
      {
        "slug": "sprint-retrospective-facilitation",
        "label": "Sprint Retrospective Facilitation"
      },
      {
        "slug": "sprint-demo-facilitation",
        "label": "Sprint Demo Facilitation"
      },
      {
        "slug": "experiment-design",
        "label": "Experiment Design"
      },
      {
        "slug": "technical-architecture-creation",
        "label": "Technical Architecture Creation"
      },
      {
        "slug": "inventorying-content",
        "label": "Inventorying Content"
      },
      {
        "slug": "developing-go-to-market-strategy",
        "label": "Developing Go-To-Market Strategy"
      },
      {
        "slug": "customer-segmentation",
        "label": "Customer Segmentation"
      },
      {
        "slug": "price-testing",
        "label": "Price Testing"
      },
      {
        "slug": "documenting-code",
        "label": "Documenting Code"
      },
      {
        "slug": "defining-team-process",
        "label": "Defining Team Process"
      },
      {
        "slug": "entity-relationship-creation",
        "label": "Entity Relationship Creation"
      },
      {